text,label,clean
"ข่าวไทยรัฐ : โตโยต้าลั่นกลองรบตลาด 2018 ส่งรถร้อนแรง ""ซี-เอชอาร์"" รุกเข้ม",0,"ข่าวไทยรัฐ : โตโยต้าลั่นกลองรบตลาด 2018 ส่งรถร้อนแรง ""ซี-เอชอาร์"" รุกเข้ม"
ตอนนี้ รัฐกำลัง ช่วยโรงงานยสูบ คับ เลย จับให้หันมาสูบ ยา แบบเดิม ผม ก็ไม่กล้าพกไปไหน ไกล เหมือนเค้ากำลังเข้มเลย เวลาไปเที่ยว ริมทะเล ยังใงมันก็ แพ้สูบยาไฟฟ้า มันฟินกว่า เยอะ,0,ตอนนี้ รัฐกำลัง ช่วยโรงงานยาสูบครับ เลยจับให้หันมาสูบยาแบบเดิม ผมก็ไม่กล้าพกไปไหนไกล เหมือนเขากำลังเข้มเลย เวลาไปเที่ยว ริมทะเล ยังไงก็แพ้สูบยาไฟฟ้า มันรู้สึกดีกว่าเยอะครับ
วันนี้รถเริ่มติดขึ้นมาหน่อย แต่btsโล่งม้ากกก (08:43 bts Asoke),0,วันนี้รถเริ่มติดขึ้นมาหน่อย แต่ bts โล่งมากครับ (08:43 bts Asoke)
โอเคพี่เลี้ยง😘😘😘😘😘,0,พี่เลี้ยงเองครับ
Official ปกติใช้บาบาล่าเบอ1 อมชมพู ดูสวยเนียนนนเข้าหน้ามากกกก แต่พอมาใช้เจ้านางเบอ2 คือมันเหลืองมากกกกกค่ะ,0,ปกติของแท้ใช้บาบาล่าเบอ1 อมชมพู ดูสวยเนียนนนเข้าหน้ามากแต่พอมาใช้เบอ2 สีออกเหลืองค่ะ
ไอ้แก๊กอ่ะ5555,0,แล้วแก๊กล่ะครับ
ผ้าอนามัยเอลิสที่เป็นลายริลัคคุมะคือกาวเหนียมาก ติดแน่นมาก แน่นจนกุแกะไม่ออก โว้ยยยยยยยยยยยยยยยยย,0,ผ้าอนามัยเอลิสที่เป็นลายริลัคคุมะกาวเหนียมากค่ะ ติดแน่นมากค่ะ แน่นจนฉันแกะไม่ออกค่ะ
ผ.อ คนไหนละ,0,ผ.อ. คนไหนหรอครับ
ตอนนี้เค้าฮิตอัญชันกันหรอ555,0,ตอนนี้เขาชอบอัญชันกันหรอครับ
เดือนนี้หมดกับ innisfree ไปสองพันละนะ ทำไมต้องวอแวอีก วอแวเก่งสุดกูเนี่ย,0,เดือนนี้ผมหมดกับ innisfree ไปสองพันละนะครับ ทำไมต้องมารบกวนอีกครับ รบกวนผมเก่งมากนะครับ
แทนที่จะบอกมาทีเดียวให้หมดว่ามีสาขาไหนร่วมบ้างมานั่งไล่ถามว่าที่ไหนมีๆ บอกมาหมดทีเดียวมันยากตรงไหน,0,แทนที่คุณจะบอกมาทีเดียวให้หมดว่ามีสาขาไหนร่วมรายการบ้าง กลายเป็นว่าผมต้องมานั่งถามไล่ทีละสาขา บอกมาหมดทีเดียวมันยากตรงไหนหรอครับ
ไม่ใช่เราแน่นอน เราไม่แดก 100,0,ไม่ใช่เราแน่นอน เราไม่กิน 100 ครับ
ยอมใจ พวก พี่ ๆ ๆ เลย ขอบคุณคาฟ,0,ยอมใจ พวก พี่ ๆ เลยครับ ขอบคุณครับ
อู๊ย... พี่น่าโดนเนอะ,0,พี่น่าโดนนะครับ
ชอบ toyotabuzz จัดกิจกรรมตลอด คืนกำไรให้กับลูกค้า,0,ชอบ toyotabuzz ครับ จัดกิจกรรมตลอด คืนกำไรให้กับลูกค้าครับ
นิสสัน navara PPV? เชย แก่ โบราณ,0,นิสสัน navara PPV ถือว่าโบราณไหมครับ
ลองอ่านดู เพื่อความมั่นใจ555555,0,ลองอ่านดู เพื่อความมั่นใจครับ
แล้วแต่เวลาชวน ไม่กินเอง,0,แล้วแต่เวลาที่ชวน ไม่ได้กินด้วยตัวเองครับ
เห็นน้องๆใช้แล้วผิวดีเลยให้คนไปซื้อมาลอง มีราคาย่อมเยาด้วยใช้ไป 2-3 ปี น้องที่ทำ snail white เลยมาชวนให้เป็น presenter,0,เห็นน้องๆ ใช้แล้วผิวดี เลยฝากคนไปซื้อมาลอง มีแบบราคาย่อมเยาด้วย ใช้ไป 2-3 ปี น้องที่ทำ snail white ก็ได้มาชวนให้เป็น presenter
ไปจัดทีวันเสาร์,0,ไปลองเสียหน่อย ในวันเสาร์นี้
เบียร์ยูเหมาะสำหรับคนที่ไม่ชอบรสขม รสชาติของเบียร์จะอ่อนๆนิ่มๆ โดยรวมๆก็ดื่มง่ายอ่ะค่ะ,0,เบียร์ยูเหมาะสำหรับคนที่ไม่ชอบรสขม รสชาติของเบียร์จะอ่อนและนิ่ม โดยรวมแล้ว ดื่มง่ายค่ะ
ไปมะ,0,ไปไหม
ไอ้ใครพิมพ์สมน้ำหน้าตะกี้นะ,0,ใครพิมพ์สมน้ำหน้าเมื่อครู่นะครับ
นี่ใช้โซฟีดึงทีกกน.แทบเป็นขุย ติดแน่นอะไรเบอร์นั้น 5555,0,ฉันใช้โซฟี เวลาดึงทีกางเกงในแทบเป็นขุย ทำไมถึงติดแน่นขนาดนั้น
สรุปแดกลีโอต่อปาย,0,สรุปแล้วว่า เลือกดื่มลีโอต่อไป